{
  "animation_id": "relict_autotile_waterdungeon6_be8febe57a2f",
  "contact_sheet": {
    "file": "contact_sheet.png",
    "height_px": 128,
    "sha256": "14cc0dbeafe1b4c0b8c2742b67b6eec32de91a7f7bbab742de31f8028e1157fd",
    "width_px": 384
  },
  "contexts": [
    {
      "usage": "AUTOTILE_SLOT",
      "zone_id": "relict_map_002"
    },
    {
      "usage": "AUTOTILE_SLOT",
      "zone_id": "relict_map_002:variant:mies_conflicted_copy_2025_12_18"
    },
    {
      "usage": "AUTOTILE_SLOT",
      "zone_id": "relict_map_002:variant:mies_conflicted_copy_2026_01_01"
    }
  ],
  "dependencies": [],
  "frame_count": 4,
  "game_id": "relict",
  "layers": [
    {
      "blend_mode": "SOURCE_ALPHA",
      "frames": [
        {
          "duration_ms": 250,
          "file": "layers/layer_00/frame_000.png",
          "index": 0,
          "sha256": "95dc9b6d2113432ad0ed1f6688483eb9ae29a7d6352ee07777c9297809b5302d"
        },
        {
          "duration_ms": 250,
          "file": "layers/layer_00/frame_001.png",
          "index": 1,
          "sha256": "7a627113c9877b2fe2176e3926180983660f166cec5766bd270d2576bf42703c"
        },
        {
          "duration_ms": 250,
          "file": "layers/layer_00/frame_002.png",
          "index": 2,
          "sha256": "dc09079eea5f673e000b5fb5c841d4470480521ac8c54109d9e4632c8e98b489"
        },
        {
          "duration_ms": 250,
          "file": "layers/layer_00/frame_003.png",
          "index": 3,
          "sha256": "6b513a30ea9d40390714a727e0803cfa4b122279745a4f0285e7c58160ece985"
        }
      ],
      "layer_id": "layer_00",
      "order": 0
    }
  ],
  "loop": true,
  "loop_start": 0,
  "pmdo_dtef_candidate": true,
  "provenance": {
    "commit": "6963878956ec4c53833c03f26aa6a9aafd17800f",
    "extraction_method": "bounded pure-Python Ruby Marshal 4.8 reader; no source code execution",
    "license_status": "UNKNOWN",
    "repository": "https://github.com/meromoonmeri/BIBLIOTHEQUE",
    "sha256": "be8febe57a2feb2f7492188429d03deb77ca8911fa96bac21b67a35db4618c28",
    "size_bytes": 3268,
    "source_format": "png",
    "source_path": "Relict/Relict V1.2/Relict/Graphics/Autotiles/waterDungeon6.png"
  },
  "schema_version": "1.0.0",
  "source_frame_layout": "RMXP_AUTOTILE_96x128_HORIZONTAL_FRAMES",
  "status": "SOURCE_DOCUMENTED",
  "timing_authority": "SOURCE_EXACT",
  "timing_provenance": {
    "constant": 5,
    "method": "STATIC_SCRIPT_CONSTANT",
    "sha256": "5ccca09476a6843bcda02bfd384b6d7efa9e101877541a0161a408c8a5cada01",
    "source_path": "Data/Scripts/006_Map renderer/001_TilemapRenderer.rb",
    "static_audit_only": true,
    "units": "1/20 second"
  }
}
